{
  "id": "tech-format-honesty-search-06",
  "status": "confirmed",
  "source": {
    "platform": "google",
    "url_or_library_id": "synthesis:fm_search_text_as_video",
    "accessed": "2026-10-10",
    "rights": "annotation-only",
    "verified_via": "synthesis"
  },
  "niche": "home-services",
  "format": "search_text",
  "structure": {
    "format": "search_text",
    "timing_observable": false,
    "format_note": "Teaching card: format must survive projection into packages/QA"
  },
  "duration_s": null,
  "aspect": "n/a",
  "hook": {
    "mechanism": "format honesty",
    "first_second_description": "If observation was search text, card must say so — never mint fake seconds",
    "on_screen_text": "format=search_text"
  },
  "shots": [
    {
      "t_start": null,
      "t_end": null,
      "purpose": "record format + timing_observable:false",
      "source": "synthesis"
    },
    {
      "t_start": null,
      "t_end": null,
      "purpose": "steal structure words not seconds",
      "source": "synthesis"
    },
    {
      "t_start": null,
      "t_end": null,
      "purpose": "video twin needs a video_timed card",
      "source": "synthesis"
    }
  ],
  "stats": {
    "shot_count": 0,
    "avg_shot_s": 0,
    "cuts_per_10s": 0,
    "longest_hold_s": 0,
    "first_cut_at_s": 0,
    "text_density": "n/a",
    "loudness_lufs": null,
    "stats_source": "n/a — search_text"
  },
  "audio": {
    "note": "none"
  },
  "look": {
    "note": "n/a"
  },
  "cta": {
    "primary": "n/a — process card"
  },
  "offer_and_proof": {
    "offer": "n/a",
    "proof": "validators reject timing_observable:true on search_text"
  },
  "why_it_works": "Format lies (search→fake 0–3s) poisoned Oply planning; this card encodes the firewall.",
  "steal": [
    "Keep structure.format + timing_observable first-class",
    "Use video_timed study for video twins",
    "Project format through retrieve → package → QA"
  ],
  "what_not_to_copy": [
    "Invented 0–3s from RSA rows",
    "Dropping format in compact retrieve maps"
  ],
  "tags": [
    "technique",
    "format-honesty",
    "search_text",
    "home-services",
    "qa"
  ]
}
