{
  "id": "tech-caption-not-headline-02",
  "status": "confirmed",
  "source": {
    "platform": "meta",
    "url_or_library_id": "synthesis:fm_duplicate_text",
    "accessed": "2026-10-10",
    "rights": "annotation-only",
    "verified_via": "synthesis"
  },
  "niche": "home-services",
  "format": "UGC",
  "structure": {
    "format": "video_timed",
    "timing_observable": true
  },
  "duration_s": 12,
  "aspect": "9:16",
  "hook": {
    "mechanism": "caption ≠ headline discipline",
    "first_second_description": "Headline states pain; caption adds mechanism — never duplicates",
    "on_screen_text": "Missed the job",
    "spoken": "Your agent books it instead."
  },
  "shots": [
    {
      "t_start": 0,
      "t_end": 4,
      "purpose": "headline pain",
      "source": "synthesis",
      "on_screen_text": "Missed the job",
      "caption_style": "burned distinct from VO",
      "transition_out": "hard"
    },
    {
      "t_start": 4,
      "t_end": 8,
      "purpose": "caption mechanism",
      "source": "synthesis",
      "on_screen_text": "Answers + books",
      "transition_out": "hard"
    },
    {
      "t_start": 8,
      "t_end": 12,
      "purpose": "CTA",
      "source": "synthesis",
      "shot_type": "endcard",
      "transition_out": "hold"
    }
  ],
  "stats": {
    "shot_count": 3,
    "avg_shot_s": 4,
    "cuts_per_10s": 1.67,
    "longest_hold_s": 4,
    "first_cut_at_s": 4,
    "text_density": "muted-first ≤8 words/card",
    "loudness_lufs": null,
    "stats_source": "synthesis-estimate from attention-model timing"
  },
  "audio": {
    "captions": "must differ from headline layer"
  },
  "look": {
    "layers": "headline + caption + VO are three jobs"
  },
  "cta": {
    "primary": "one"
  },
  "offer_and_proof": {
    "offer": "n/a technique",
    "proof": "duplicate-text QA"
  },
  "why_it_works": "Duplicate headline/caption wastes mute-readable surface and fails frame QA (fm_duplicate_text).",
  "steal": [
    "Headline = pain",
    "Caption = mechanism",
    "VO may echo one, not both"
  ],
  "what_not_to_copy": [
    "Same string on two layers",
    "Competitor caption packs"
  ],
  "tags": [
    "technique",
    "captions",
    "qa",
    "home-services"
  ]
}
