{
  "id": "after-hours-ring-timestamp-04",
  "status": "confirmed",
  "source": {
    "platform": "tiktok",
    "url_or_library_id": "synthesis:am_voice_agent_missed+niche-pack-hook-bank",
    "accessed": "2026-10-10",
    "rights": "annotation-only",
    "verified_via": "synthesis"
  },
  "niche": "home-services",
  "format": "UGC",
  "structure": {
    "format": "video_timed",
    "timing_observable": true
  },
  "duration_s": 18,
  "aspect": "9:16",
  "hook": {
    "mechanism": "timestamp + ring into void",
    "first_second_description": "Burned 10:47 PM + continuous ring; cut to silence of empty shop",
    "on_screen_text": "10:47 PM",
    "spoken": "After hours. Still ringing."
  },
  "shots": [
    {
      "t_start": 0,
      "t_end": 2,
      "purpose": "timestamp sting",
      "source": "synthesis",
      "on_screen_text": "10:47 PM",
      "transition_out": "hard",
      "sfx": "ring"
    },
    {
      "t_start": 2,
      "t_end": 6,
      "purpose": "void hold",
      "source": "synthesis",
      "subject": "empty bay/desk",
      "transition_out": "hard"
    },
    {
      "t_start": 6,
      "t_end": 12,
      "purpose": "agent answers",
      "source": "synthesis",
      "shot_type": "screen",
      "subject": "answer waveform/UI",
      "transition_out": "hard"
    },
    {
      "t_start": 12,
      "t_end": 18,
      "purpose": "CTA + hours claim if true",
      "source": "synthesis",
      "shot_type": "endcard",
      "on_screen_text": "After-hours included",
      "transition_out": "hold"
    }
  ],
  "stats": {
    "shot_count": 4,
    "avg_shot_s": 4.5,
    "cuts_per_10s": 1.67,
    "longest_hold_s": 4.5,
    "first_cut_at_s": 2,
    "text_density": "muted-first ≤8 words/card",
    "loudness_lufs": null,
    "stats_source": "synthesis-estimate from attention-model timing"
  },
  "audio": {
    "sfx": "ring then abrupt silence",
    "vo": "short",
    "music": "none or licensed pulse"
  },
  "look": {
    "contrast": "dark shop vs bright UI"
  },
  "cta": {
    "primary": "call / book",
    "hours_claim": "only if published on site"
  },
  "offer_and_proof": {
    "offer": "after-hours included (when true)",
    "proof": "published hours fact — ASSET_VERIFIED from site"
  },
  "why_it_works": "Timestamp makes after-hours concrete; silence after the ring sells the pain without a speech.",
  "steal": [
    "Timestamp in first 2s",
    "Ring→silence cut",
    "Hours claim only when site-true"
  ],
  "what_not_to_copy": [
    "Invented after-hours coverage",
    "Competitor caller audio",
    "Kids-app mascot in the void beat"
  ],
  "tags": [
    "home-services",
    "after-hours",
    "hook",
    "tiktok",
    "voice-ai"
  ]
}
