{
  "id": "tech-flat-ui-documentary-04",
  "status": "confirmed",
  "source": {
    "platform": "meta",
    "url_or_library_id": "synthesis:am_ui_aha_saas+fm_no_product_demo",
    "accessed": "2026-10-10",
    "rights": "annotation-only",
    "verified_via": "synthesis"
  },
  "niche": "home-services",
  "format": "screen-recording",
  "structure": {
    "format": "video_timed",
    "timing_observable": true
  },
  "duration_s": 14,
  "aspect": "9:16",
  "hook": {
    "mechanism": "flat UI documentary look",
    "first_second_description": "Orthographic product UI, true chrome, no neon cockpit",
    "on_screen_text": "Real UI"
  },
  "shots": [
    {
      "t_start": 0,
      "t_end": 4,
      "purpose": "idle state",
      "source": "synthesis",
      "shot_type": "screen",
      "transition_out": "hard"
    },
    {
      "t_start": 4,
      "t_end": 9,
      "purpose": "answered state",
      "source": "synthesis",
      "shot_type": "screen",
      "transition_out": "hard"
    },
    {
      "t_start": 9,
      "t_end": 14,
      "purpose": "confirm state",
      "source": "synthesis",
      "shot_type": "screen",
      "transition_out": "hold"
    }
  ],
  "stats": {
    "shot_count": 3,
    "avg_shot_s": 4.67,
    "cuts_per_10s": 1.43,
    "longest_hold_s": 4.67,
    "first_cut_at_s": 4,
    "text_density": "muted-first ≤8 words/card",
    "loudness_lufs": null,
    "stats_source": "synthesis-estimate from attention-model timing"
  },
  "audio": {
    "sfx": "soft UI",
    "vo": "optional mechanism"
  },
  "look": {
    "ui": "flat, high-contrast ≥4.5:1",
    "avoid": "purple glow, holographic panels, rubber 3D AI brains"
  },
  "cta": {
    "primary": "after confirm state"
  },
  "offer_and_proof": {
    "offer": "show the product working",
    "proof": "three authentic UI states"
  },
  "why_it_works": "Voice products fail when the ad never shows a call; flat UI states are the demo language for DR.",
  "steal": [
    "3 UI states minimum",
    "Contrast ≥4.5:1",
    "No neon metaphor"
  ],
  "what_not_to_copy": [
    "Competitor dashboards",
    "Invented metrics",
    "Kids-app mascot as UI"
  ],
  "tags": [
    "technique",
    "ui",
    "product-demo",
    "home-services"
  ]
}
